{
  "id": "ATM_PCTILE|AUDUSD|*",
  "type": "SURFACE_RICH",
  "pair": "AUDUSD",
  "tenors": [
    "1M",
    "1W",
    "1Y",
    "2M",
    "2W",
    "3M",
    "6M",
    "ON"
  ],
  "headline": "atm rich across 8 tenors (lead 1W p100)",
  "structure": "atm curve",
  "band": "SPECULATIVE",
  "confidence": {
    "absZ": 3.54,
    "persistedCycles": 4,
    "dataQualityOk": true,
    "modelsAgree": true,
    "backtestPrior": null
  },
  "findings": "Broad atm repricing \u2014 one event, 8 tenors at extremes; trade the curve, not a node.",
  "evidence": [
    {
      "label": "1M atm",
      "value": "9.683 (p100)",
      "provenance": "derived:percentile(store://vol/AUDUSD/1M/atm)"
    },
    {
      "label": "1W atm",
      "value": "9.659 (p100)",
      "provenance": "derived:percentile(store://vol/AUDUSD/1W/atm)"
    },
    {
      "label": "1Y atm",
      "value": "10.081 (p99)",
      "provenance": "derived:percentile(store://vol/AUDUSD/1Y/atm)"
    },
    {
      "label": "2M atm",
      "value": "9.726 (p99)",
      "provenance": "derived:percentile(store://vol/AUDUSD/2M/atm)"
    },
    {
      "label": "2W atm",
      "value": "9.574 (p98)",
      "provenance": "derived:percentile(store://vol/AUDUSD/2W/atm)"
    },
    {
      "label": "3M atm",
      "value": "9.784 (p99)",
      "provenance": "derived:percentile(store://vol/AUDUSD/3M/atm)"
    }
  ],
  "supporting": [
    {
      "label": "lead z",
      "value": "+3.54",
      "provenance": "derived:zscore(store://vol/AUDUSD/1W/atm)"
    }
  ],
  "contradictions": [
    {
      "label": "single driver",
      "value": "tenor breaches share one underlying drift \u2014 not independent confirmations",
      "provenance": "derived:count(store://vol/AUDUSD/1W/atm)"
    }
  ],
  "invalidation_criteria": [
    "fewer than 3 tenors beyond p90/p10",
    "lead tenor atm crosses p50"
  ],
  "similar_history_items": [
    {
      "label": "prior ATM_PCTILE|EURGBP|*",
      "value": "new \u2192 new",
      "provenance": "ledger:card(ATM_PCTILE|EURGBP|*)"
    },
    {
      "label": "prior ATM_PCTILE|EURJPY|*",
      "value": "new \u2192 new",
      "provenance": "ledger:card(ATM_PCTILE|EURJPY|*)"
    },
    {
      "label": "prior ATM_PCTILE|EURUSD|*",
      "value": "new \u2192 new",
      "provenance": "ledger:card(ATM_PCTILE|EURUSD|*)"
    },
    {
      "label": "prior ATM_PCTILE|USDJPY|*",
      "value": "new \u2192 new",
      "provenance": "ledger:card(ATM_PCTILE|USDJPY|*)"
    }
  ],
  "similar_history_note": "from the decision ledger",
  "status": "new",
  "created_at": "2026-06-12T07:08:39.533822+00:00",
  "updated_at": "2026-06-12T07:09:09.770500+00:00",
  "detected_at": "2026-06-12T07:08:39.533822+00:00",
  "dismissal": null,
  "invalidation": null,
  "analyst_rank": 4,
  "analyst_note": "speculative \u00b7 holds attention while the driver persists"
}